{
  "headers": {
    "content-type": "application/json",
    "x-ores-request-id": "req_01"
  },
  "query": {
    "tag": ["one", "two"]
  },
  "json_payload": {
    "hello": "world",
    "count": 2,
    "enabled": true,
    "nested": { "ok": true },
    "items": [1, 2, 3]
  },
  "representation": "application/json",
  "raw_body_bytes": 91,
  "attributes": {
    "request_id": "req_01",
    "trace_id": "0123456789abcdef0123456789abcdef",
    "tenant_id": "tenant_01",
    "user_id": "user_01"
  }
}
